"","GO.ID","Term","Annotated","Significant","Expected","Fisher","ontology","cluster"
"1","GO:0030204","chondroitin sulfate metabolic process",100,5,1.57,0.00042,"Biological Processes","1"
"2","GO:0014012","peripheral nervous system axon regeneration",10,3,0.16,0.00043,"Biological Processes","1"
"3","GO:0060071","Wnt signaling pathway, planar cell polarity pathway",139,11,2.19,0.00076,"Biological Processes","1"
"4","GO:0022008","neurogenesis",1557,37,24.49,0.00086,"Biological Processes","1"
"5","GO:0090090","negative regulation of canonical Wnt signaling path...",193,10,3.04,0.00099,"Biological Processes","1"
"6","GO:0090103","cochlea morphogenesis",100,7,1.57,0.00102,"Biological Processes","1"
"7","GO:0010923","negative regulation of phosphatase activity",29,4,0.46,0.00104,"Biological Processes","1"
"8","GO:2000095","regulation of Wnt signaling pathway, planar cell po...",14,3,0.22,0.00123,"Biological Processes","1"
"9","GO:0007156","homophilic cell adhesion via plasma membrane adhesi...",200,10,3.15,0.00129,"Biological Processes","1"
"10","GO:0060027","convergent extension involved in gastrulation",15,3,0.24,0.00152,"Biological Processes","1"
"11","GO:0071300","cellular response to retinoic acid",82,6,1.29,0.00185,"Biological Processes","1"
"12","GO:0043161","proteasome-mediated ubiquitin-dependent protein cat...",221,9,3.48,0.00227,"Biological Processes","1"
"13","GO:0050982","detection of mechanical stimulus",170,9,2.67,0.0032,"Biological Processes","1"
"14","GO:0072300","positive regulation of metanephric glomerulus devel...",40,4,0.63,0.00351,"Biological Processes","1"
"15","GO:0035799","ureter maturation",40,4,0.63,0.00351,"Biological Processes","1"
"16","GO:0021940","positive regulation of cerebellar granule cell prec...",6,2,0.09,0.00355,"Biological Processes","1"
"17","GO:0060447","bud outgrowth involved in lung branching",6,2,0.09,0.00355,"Biological Processes","1"
"18","GO:0060739","mesenchymal-epithelial cell signaling involved in p...",6,2,0.09,0.00355,"Biological Processes","1"
"19","GO:0071799","cellular response to prostaglandin D stimulus",6,2,0.09,0.00355,"Biological Processes","1"
"20","GO:1900020","positive regulation of protein kinase C activity",6,2,0.09,0.00355,"Biological Processes","1"
"21","GO:0030162","regulation of proteolysis",272,9,4.28,0.00366,"Biological Processes","1"
"22","GO:0032703","negative regulation of interleukin-2 production",8,2,0.13,0.00648,"Biological Processes","1"
"23","GO:0048678","response to axon injury",75,7,1.18,0.00663,"Biological Processes","1"
"24","GO:0010800","positive regulation of peptidyl-threonine phosphory...",26,3,0.41,0.00766,"Biological Processes","1"
"25","GO:0055129","L-proline biosynthetic process",9,2,0.14,0.00825,"Biological Processes","1"
"26","GO:0043406","positive regulation of MAP kinase activity",105,6,1.65,0.00826,"Biological Processes","1"
"27","GO:0001502","cartilage condensation",27,3,0.42,0.00852,"Biological Processes","1"
"28","GO:0060041","retina development in camera-type eye",197,11,3.1,0.0098,"Biological Processes","1"
"29","GO:0035726","common myeloid progenitor cell proliferation",10,2,0.16,0.01021,"Biological Processes","1"
"30","GO:0060122","inner ear receptor cell stereocilium organization",118,6,1.86,0.01091,"Biological Processes","1"
"31","GO:0031104","dendrite regeneration",11,2,0.17,0.01235,"Biological Processes","1"
"32","GO:0043932","ossification involved in bone remodeling",91,5,1.43,0.01441,"Biological Processes","1"
"33","GO:0090177","establishment of planar polarity involved in neural...",91,5,1.43,0.01441,"Biological Processes","1"
"34","GO:0030205","dermatan sulfate metabolic process",12,2,0.19,0.01466,"Biological Processes","1"
"35","GO:0007447","imaginal disc pattern formation",25,3,0.39,0.01564,"Biological Processes","1"
"36","GO:0036148","phosphatidylglycerol acyl-chain remodeling",1,1,0.02,0.01573,"Biological Processes","1"
"37","GO:0036149","phosphatidylinositol acyl-chain remodeling",1,1,0.02,0.01573,"Biological Processes","1"
"38","GO:0036261","7-methylguanosine cap hypermethylation",1,1,0.02,0.01573,"Biological Processes","1"
"39","GO:0045317","equator specification",1,1,0.02,0.01573,"Biological Processes","1"
"40","GO:0046013","regulation of T cell homeostatic proliferation",1,1,0.02,0.01573,"Biological Processes","1"
"41","GO:0090176","microtubule cytoskeleton organization involved in e...",1,1,0.02,0.01573,"Biological Processes","1"
"42","GO:0010189","vitamin E biosynthetic process",1,1,0.02,0.01573,"Biological Processes","1"
"43","GO:0000911","cytokinesis by cell plate formation",1,1,0.02,0.01573,"Biological Processes","1"
"44","GO:0000918","division septum site selection",1,1,0.02,0.01573,"Biological Processes","1"
"45","GO:2000594","positive regulation of metanephric DCT cell differe...",1,1,0.02,0.01573,"Biological Processes","1"
"46","GO:2000597","positive regulation of optic nerve formation",1,1,0.02,0.01573,"Biological Processes","1"
"47","GO:0030328","prenylcysteine catabolic process",1,1,0.02,0.01573,"Biological Processes","1"
"48","GO:0001879","detection of yeast",1,1,0.02,0.01573,"Biological Processes","1"
"49","GO:0030473","nuclear migration along microtubule",1,1,0.02,0.01573,"Biological Processes","1"
"50","GO:0071477","cellular hypotonic salinity response",1,1,0.02,0.01573,"Biological Processes","1"
"51","GO:1900215","negative regulation of apoptotic process involved i...",1,1,0.02,0.01573,"Biological Processes","1"
"52","GO:0016336","establishment or maintenance of polarity of larval ...",1,1,0.02,0.01573,"Biological Processes","1"
"53","GO:0061360","optic chiasma development",1,1,0.02,0.01573,"Biological Processes","1"
"54","GO:0072305","negative regulation of mesenchymal cell apoptotic p...",1,1,0.02,0.01573,"Biological Processes","1"
"55","GO:0035209","pupal development",1,1,0.02,0.01573,"Biological Processes","1"
"56","GO:0021650","vestibulocochlear nerve formation",1,1,0.02,0.01573,"Biological Processes","1"
"57","GO:0001928","regulation of exocyst assembly",1,1,0.02,0.01573,"Biological Processes","1"
"58","GO:0072179","nephric duct formation",1,1,0.02,0.01573,"Biological Processes","1"
"59","GO:0072108","positive regulation of mesenchymal to epithelial tr...",1,1,0.02,0.01573,"Biological Processes","1"
"60","GO:0045918","negative regulation of cytolysis",1,1,0.02,0.01573,"Biological Processes","1"
"61","GO:0035566","regulation of metanephros size",1,1,0.02,0.01573,"Biological Processes","1"
"62","GO:0045669","positive regulation of osteoblast differentiation",166,7,2.61,0.01616,"Biological Processes","1"
"63","GO:0072307","regulation of metanephric nephron tubule epithelial...",13,2,0.2,0.01715,"Biological Processes","1"
"64","GO:0043152","induction of bacterial agglutination",36,3,0.57,0.01875,"Biological Processes","1"
"65","GO:0048047","mating behavior, sex discrimination",36,3,0.57,0.01875,"Biological Processes","1"
"66","GO:0032438","melanosome organization",14,2,0.22,0.01981,"Biological Processes","1"
"67","GO:0033141","positive regulation of peptidyl-serine phosphorylat...",39,3,0.61,0.02319,"Biological Processes","1"
"68","GO:0033690","positive regulation of osteoblast proliferation",103,5,1.62,0.02335,"Biological Processes","1"
"69","GO:0050766","positive regulation of phagocytosis",40,3,0.63,0.02479,"Biological Processes","1"
"70","GO:0001838","embryonic epithelial tube formation",245,10,3.85,0.02549,"Biological Processes","1"
"71","GO:0097264","self proteolysis",16,2,0.25,0.02558,"Biological Processes","1"
"72","GO:0043393","regulation of protein binding",206,8,3.24,0.0281,"Biological Processes","1"
"73","GO:0061146","Peyer's patch morphogenesis",42,3,0.66,0.02815,"Biological Processes","1"
"74","GO:2001244","positive regulation of intrinsic apoptotic signalin...",17,2,0.27,0.0287,"Biological Processes","1"
"75","GO:0014042","positive regulation of neuron maturation",43,3,0.68,0.02992,"Biological Processes","1"
"76","GO:2001241","positive regulation of extrinsic apoptotic signalin...",43,3,0.68,0.02992,"Biological Processes","1"
"77","GO:0060249","anatomical structure homeostasis",268,7,4.22,0.031,"Biological Processes","1"
"78","GO:0036150","phosphatidylserine acyl-chain remodeling",2,1,0.03,0.03121,"Biological Processes","1"
"79","GO:0006420","arginyl-tRNA aminoacylation",2,1,0.03,0.03121,"Biological Processes","1"
"80","GO:0006425","glutaminyl-tRNA aminoacylation",2,1,0.03,0.03121,"Biological Processes","1"
"81","GO:1904251","regulation of bile acid metabolic process",2,1,0.03,0.03121,"Biological Processes","1"
"82","GO:0014843","growth factor dependent regulation of skeletal musc...",2,1,0.03,0.03121,"Biological Processes","1"
"83","GO:0045498","sex comb development",2,1,0.03,0.03121,"Biological Processes","1"
"84","GO:2000791","negative regulation of mesenchymal cell proliferati...",2,1,0.03,0.03121,"Biological Processes","1"
"85","GO:0090149","mitochondrial membrane fission",2,1,0.03,0.03121,"Biological Processes","1"
"86","GO:2000884","glucomannan catabolic process",2,1,0.03,0.03121,"Biological Processes","1"
"87","GO:0032498","detection of muramyl dipeptide",2,1,0.03,0.03121,"Biological Processes","1"
"88","GO:0006741","NADP biosynthetic process",2,1,0.03,0.03121,"Biological Processes","1"
"89","GO:0070660","inner ear receptor cell differentiation involved in...",2,1,0.03,0.03121,"Biological Processes","1"
"90","GO:0070634","transepithelial ammonium transport",2,1,0.03,0.03121,"Biological Processes","1"
"91","GO:1902824","positive regulation of late endosome to lysosome tr...",2,1,0.03,0.03121,"Biological Processes","1"
"92","GO:0033364","mast cell secretory granule organization",2,1,0.03,0.03121,"Biological Processes","1"
"93","GO:0032740","positive regulation of interleukin-17 production",2,1,0.03,0.03121,"Biological Processes","1"
"94","GO:0045571","negative regulation of imaginal disc growth",2,1,0.03,0.03121,"Biological Processes","1"
"95","GO:0032701","negative regulation of interleukin-18 production",2,1,0.03,0.03121,"Biological Processes","1"
"96","GO:0060585","positive regulation of prostaglandin-endoperoxide s...",2,1,0.03,0.03121,"Biological Processes","1"
"97","GO:0006965","positive regulation of biosynthetic process of anti...",2,1,0.03,0.03121,"Biological Processes","1"
"98","GO:0072162","metanephric mesenchymal cell differentiation",2,1,0.03,0.03121,"Biological Processes","1"
"99","GO:0021628","olfactory nerve formation",2,1,0.03,0.03121,"Biological Processes","1"
"100","GO:0045048","protein insertion into ER membrane",2,1,0.03,0.03121,"Biological Processes","1"
"101","GO:1900063","regulation of peroxisome organization",2,1,0.03,0.03121,"Biological Processes","1"
"102","GO:0072289","metanephric nephron tubule formation",2,1,0.03,0.03121,"Biological Processes","1"
"103","GO:0071608","macrophage inflammatory protein-1 alpha production",2,1,0.03,0.03121,"Biological Processes","1"
"104","GO:0048265","response to pain",76,4,1.2,0.03181,"Biological Processes","1"
"105","GO:0048190","wing disc dorsal/ventral pattern formation",18,2,0.28,0.03196,"Biological Processes","1"
"106","GO:0016045","detection of bacterium",18,2,0.28,0.03196,"Biological Processes","1"
"107","GO:0007157","heterophilic cell-cell adhesion via plasma membrane...",78,4,1.23,0.03453,"Biological Processes","1"
"108","GO:0010842","retina layer formation",46,3,0.72,0.03557,"Biological Processes","1"
"109","GO:0006879","intracellular iron ion homeostasis",47,3,0.74,0.03757,"Biological Processes","1"
"110","GO:0045793","positive regulation of cell size",47,3,0.74,0.03757,"Biological Processes","1"
"111","GO:0033630","positive regulation of cell adhesion mediated by in...",49,3,0.77,0.04173,"Biological Processes","1"
"112","GO:0048484","enteric nervous system development",49,3,0.77,0.04173,"Biological Processes","1"
"113","GO:0008347","glial cell migration",49,3,0.77,0.04173,"Biological Processes","1"
"114","GO:0008340","determination of adult lifespan",83,4,1.31,0.0419,"Biological Processes","1"
"115","GO:0048704","embryonic skeletal system morphogenesis",107,5,1.68,0.04207,"Biological Processes","1"
"116","GO:0000165","MAPK cascade",896,15,14.09,0.04437,"Biological Processes","1"
"117","GO:0006873","intracellular monoatomic ion homeostasis",431,13,6.78,0.04554,"Biological Processes","1"
"118","GO:0021516","dorsal spinal cord development",9,2,0.14,0.0463,"Biological Processes","1"
"119","GO:0060740","prostate gland epithelium morphogenesis",22,2,0.35,0.04631,"Biological Processes","1"
"120","GO:0046668","regulation of retinal cell programmed cell death",3,1,0.05,0.04645,"Biological Processes","1"
"121","GO:2000110","negative regulation of macrophage apoptotic process",3,1,0.05,0.04645,"Biological Processes","1"
"122","GO:0014813","skeletal muscle satellite cell commitment",3,1,0.05,0.04645,"Biological Processes","1"
"123","GO:0071909","determination of stomach left/right asymmetry",3,1,0.05,0.04645,"Biological Processes","1"
"124","GO:0071494","cellular response to UV-C",3,1,0.05,0.04645,"Biological Processes","1"
"125","GO:0045719","negative regulation of glycogen biosynthetic proces...",3,1,0.05,0.04645,"Biological Processes","1"
"126","GO:0006663","platelet activating factor biosynthetic process",3,1,0.05,0.04645,"Biological Processes","1"
"127","GO:0015798","myo-inositol transport",3,1,0.05,0.04645,"Biological Processes","1"
"128","GO:0001675","acrosome assembly",3,1,0.05,0.04645,"Biological Processes","1"
"129","GO:0032733","positive regulation of interleukin-10 production",3,1,0.05,0.04645,"Biological Processes","1"
"130","GO:0002227","innate immune response in mucosa",3,1,0.05,0.04645,"Biological Processes","1"
"131","GO:1902523","positive regulation of protein K63-linked ubiquitin...",3,1,0.05,0.04645,"Biological Processes","1"
"132","GO:0070981","L-asparagine biosynthetic process",3,1,0.05,0.04645,"Biological Processes","1"
"133","GO:0032873","negative regulation of stress-activated MAPK cascad...",3,1,0.05,0.04645,"Biological Processes","1"
"134","GO:0032874","positive regulation of stress-activated MAPK cascad...",3,1,0.05,0.04645,"Biological Processes","1"
"135","GO:0038109","Kit signaling pathway",3,1,0.05,0.04645,"Biological Processes","1"
"136","GO:0016188","synaptic vesicle maturation",3,1,0.05,0.04645,"Biological Processes","1"
"137","GO:0032510","endosome to lysosome transport via multivesicular b...",3,1,0.05,0.04645,"Biological Processes","1"
"138","GO:0032689","negative regulation of type II interferon productio...",3,1,0.05,0.04645,"Biological Processes","1"
"139","GO:0010025","wax biosynthetic process",3,1,0.05,0.04645,"Biological Processes","1"
"140","GO:0042308","negative regulation of protein import into nucleus",3,1,0.05,0.04645,"Biological Processes","1"
"141","GO:0007637","proboscis extension reflex",3,1,0.05,0.04645,"Biological Processes","1"
"142","GO:0070431","nucleotide-binding oligomerization domain containin...",3,1,0.05,0.04645,"Biological Processes","1"
"143","GO:0008543","fibroblast growth factor receptor signaling pathway",209,7,3.29,0.04767,"Biological Processes","1"
"144","GO:0047757","chondroitin-glucuronate 5-epimerase activity",6,2,0.09,0.0035,"Molecular Functions","1"
"145","GO:0005509","calcium ion binding",1711,41,26.63,0.0036,"Molecular Functions","1"
"146","GO:0004735","pyrroline-5-carboxylate reductase activity",7,2,0.11,0.0048,"Molecular Functions","1"
"147","GO:0004518","nuclease activity",842,16,13.11,0.0051,"Molecular Functions","1"
"148","GO:0043531","ADP binding",73,5,1.14,0.0056,"Molecular Functions","1"
"149","GO:0005524","ATP binding",2243,49,34.91,0.0088,"Molecular Functions","1"
"150","GO:0045545","syndecan binding",10,2,0.16,0.01,"Molecular Functions","1"
"151","GO:0017147","Wnt-protein binding",158,7,2.46,0.012,"Molecular Functions","1"
"152","GO:0005248","voltage-gated sodium channel activity",32,3,0.5,0.0133,"Molecular Functions","1"
"153","GO:0008073","ornithine decarboxylase inhibitor activity",1,1,0.02,0.0156,"Molecular Functions","1"
"154","GO:0015379","potassium:chloride symporter activity",1,1,0.02,0.0156,"Molecular Functions","1"
"155","GO:0001735","prenylcysteine oxidase activity",1,1,0.02,0.0156,"Molecular Functions","1"
"156","GO:0005366","myo-inositol:proton symporter activity",1,1,0.02,0.0156,"Molecular Functions","1"
"157","GO:0071164","RNA cap trimethylguanosine synthase activity",1,1,0.02,0.0156,"Molecular Functions","1"
"158","GO:0035299","inositol-1,3,4,5,6-pentakisphosphate 2-kinase activ...",1,1,0.02,0.0156,"Molecular Functions","1"
"159","GO:0060001","minus-end directed microfilament motor activity",1,1,0.02,0.0156,"Molecular Functions","1"
"160","GO:0061654","NEDD8 conjugating enzyme activity",1,1,0.02,0.0156,"Molecular Functions","1"
"161","GO:0001872","(1->3)-beta-D-glucan binding",1,1,0.02,0.0156,"Molecular Functions","1"
"162","GO:1990275","preribosome binding",1,1,0.02,0.0156,"Molecular Functions","1"
"163","GO:0009976","tocopherol cyclase activity",1,1,0.02,0.0156,"Molecular Functions","1"
"164","GO:0046961","proton-transporting ATPase activity, rotational mec...",13,2,0.2,0.0168,"Molecular Functions","1"
"165","GO:0005537","D-mannose binding",38,3,0.59,0.0211,"Molecular Functions","1"
"166","GO:0005262","calcium channel activity",241,9,3.75,0.0233,"Molecular Functions","1"
"167","GO:0005109","frizzled binding",144,6,2.24,0.0253,"Molecular Functions","1"
"168","GO:0005044","scavenger receptor activity",189,7,2.94,0.0288,"Molecular Functions","1"
"169","GO:0032500","muramyl dipeptide binding",2,1,0.03,0.0309,"Molecular Functions","1"
"170","GO:0000171","ribonuclease MRP activity",2,1,0.03,0.0309,"Molecular Functions","1"
"171","GO:0004100","chitin synthase activity",2,1,0.03,0.0309,"Molecular Functions","1"
"172","GO:0004814","arginine-tRNA ligase activity",2,1,0.03,0.0309,"Molecular Functions","1"
"173","GO:0004819","glutamine-tRNA ligase activity",2,1,0.03,0.0309,"Molecular Functions","1"
"174","GO:0046923","ER retention sequence binding",2,1,0.03,0.0309,"Molecular Functions","1"
"175","GO:0046555","acetylxylan esterase activity",2,1,0.03,0.0309,"Molecular Functions","1"
"176","GO:0016768","spermine synthase activity",2,1,0.03,0.0309,"Molecular Functions","1"
"177","GO:0005104","fibroblast growth factor receptor binding",22,2,0.34,0.0455,"Molecular Functions","1"
"178","GO:0015018","galactosylgalactosylxylosylprotein 3-beta-glucurono...",3,1,0.05,0.046,"Molecular Functions","1"
"179","GO:0060072","large conductance calcium-activated potassium chann...",3,1,0.05,0.046,"Molecular Functions","1"
"180","GO:0004594","pantothenate kinase activity",3,1,0.05,0.046,"Molecular Functions","1"
"181","GO:0035402","histone H3T11 kinase activity",3,1,0.05,0.046,"Molecular Functions","1"
"182","GO:0004415","hyalurononglucosaminidase activity",3,1,0.05,0.046,"Molecular Functions","1"
"183","GO:0021915","neural tube development",364,25,11.05,1.3e-05,"Biological Processes","2"
"184","GO:0035278","miRNA-mediated gene silencing by inhibition of tran...",119,14,3.61,1.5e-05,"Biological Processes","2"
"185","GO:0051865","protein autoubiquitination",207,18,6.28,6.3e-05,"Biological Processes","2"
"186","GO:0010172","embryonic body morphogenesis",104,12,3.16,7.4e-05,"Biological Processes","2"
"187","GO:0046600","negative regulation of centriole replication",4,3,0.12,0.00011,"Biological Processes","2"
"188","GO:0000082","G1/S transition of mitotic cell cycle",201,16,6.1,0.00012,"Biological Processes","2"
"189","GO:2000177","regulation of neural precursor cell proliferation",168,14,5.1,0.00027,"Biological Processes","2"
"190","GO:0060964","regulation of miRNA-mediated gene silencing",141,13,4.28,0.00027,"Biological Processes","2"
"191","GO:0010586","miRNA metabolic process",152,13,4.61,0.00075,"Biological Processes","2"
"192","GO:0007346","regulation of mitotic cell cycle",409,21,12.42,0.00084,"Biological Processes","2"
"193","GO:1903608","protein localization to cytoplasmic stress granule",2,2,0.06,0.00092,"Biological Processes","2"
"194","GO:0032902","nerve growth factor production",2,2,0.06,0.00092,"Biological Processes","2"
"195","GO:0046579","positive regulation of Ras protein signal transduct...",17,4,0.52,0.00146,"Biological Processes","2"
"196","GO:0072089","stem cell proliferation",148,12,4.49,0.00188,"Biological Processes","2"
"197","GO:0071376","cellular response to corticotropin-releasing hormon...",3,2,0.09,0.0027,"Biological Processes","2"
"198","GO:0048715","negative regulation of oligodendrocyte differentiat...",3,2,0.09,0.0027,"Biological Processes","2"
"199","GO:0032455","nerve growth factor processing",3,2,0.09,0.0027,"Biological Processes","2"
"200","GO:0007156","homophilic cell adhesion via plasma membrane adhesi...",200,14,6.07,0.00324,"Biological Processes","2"
"201","GO:0003341","cilium movement",137,6,4.16,0.00337,"Biological Processes","2"
"202","GO:0008543","fibroblast growth factor receptor signaling pathway",209,14,6.34,0.00394,"Biological Processes","2"
"203","GO:0007100","mitotic centrosome separation",11,3,0.33,0.00528,"Biological Processes","2"
"204","GO:0090650","cellular response to oxygen-glucose deprivation",4,2,0.12,0.0053,"Biological Processes","2"
"205","GO:0071504","cellular response to heparin",4,2,0.12,0.0053,"Biological Processes","2"
"206","GO:0035874","cellular response to copper ion starvation",4,2,0.12,0.0053,"Biological Processes","2"
"207","GO:0097185","cellular response to azide",4,2,0.12,0.0053,"Biological Processes","2"
"208","GO:0060760","positive regulation of response to cytokine stimulu...",39,3,1.18,0.0053,"Biological Processes","2"
"209","GO:0007165","signal transduction",5469,177,166.03,0.00566,"Biological Processes","2"
"210","GO:0030509","BMP signaling pathway",138,10,4.19,0.00617,"Biological Processes","2"
"211","GO:0009100","glycoprotein metabolic process",475,12,14.42,0.0081,"Biological Processes","2"
"212","GO:0051056","regulation of small GTPase mediated signal transduc...",202,16,6.13,0.00812,"Biological Processes","2"
"213","GO:0060395","SMAD protein signal transduction",42,5,1.28,0.00852,"Biological Processes","2"
"214","GO:0048266","behavioral response to pain",5,2,0.15,0.00865,"Biological Processes","2"
"215","GO:0045162","clustering of voltage-gated sodium channels",5,2,0.15,0.00865,"Biological Processes","2"
"216","GO:0030510","regulation of BMP signaling pathway",83,4,2.52,0.00867,"Biological Processes","2"
"217","GO:0032940","secretion by cell",979,29,29.72,0.00874,"Biological Processes","2"
"218","GO:0036159","inner dynein arm assembly",15,3,0.46,0.00964,"Biological Processes","2"
"219","GO:0010125","mycothiol biosynthetic process",29,4,0.88,0.01092,"Biological Processes","2"
"220","GO:0031152","aggregation involved in sorocarp development",6,2,0.18,0.01272,"Biological Processes","2"
"221","GO:0071280","cellular response to copper ion",6,2,0.18,0.01272,"Biological Processes","2"
"222","GO:0032057","negative regulation of translational initiation in ...",6,2,0.18,0.01272,"Biological Processes","2"
"223","GO:0097151","positive regulation of inhibitory postsynaptic pote...",6,2,0.18,0.01272,"Biological Processes","2"
"224","GO:0045494","photoreceptor cell maintenance",31,4,0.94,0.0138,"Biological Processes","2"
"225","GO:0090090","negative regulation of canonical Wnt signaling path...",193,12,5.86,0.01501,"Biological Processes","2"
"226","GO:0006911","phagocytosis, engulfment",32,4,0.97,0.0154,"Biological Processes","2"
"227","GO:0035563","positive regulation of chromatin binding",18,3,0.55,0.01616,"Biological Processes","2"
"228","GO:0007099","centriole replication",14,5,0.43,0.01728,"Biological Processes","2"
"229","GO:0060351","cartilage development involved in endochondral bone...",27,3,0.82,0.01743,"Biological Processes","2"
"230","GO:1904322","cellular response to forskolin",7,2,0.21,0.01746,"Biological Processes","2"
"231","GO:0015705","iodide transport",7,2,0.21,0.01746,"Biological Processes","2"
"232","GO:1901386","negative regulation of voltage-gated calcium channe...",7,2,0.21,0.01746,"Biological Processes","2"
"233","GO:0045724","positive regulation of cilium assembly",7,2,0.21,0.01746,"Biological Processes","2"
"234","GO:0001702","gastrulation with mouth forming second",37,4,1.12,0.01873,"Biological Processes","2"
"235","GO:0006812","monoatomic cation transport",873,24,26.5,0.01926,"Biological Processes","2"
"236","GO:0007166","cell surface receptor signaling pathway",2495,100,75.74,0.02051,"Biological Processes","2"
"237","GO:0007018","microtubule-based movement",302,15,9.17,0.02149,"Biological Processes","2"
"238","GO:0051298","centrosome duplication",35,7,1.06,0.02247,"Biological Processes","2"
"239","GO:0030198","extracellular matrix organization",309,16,9.38,0.02253,"Biological Processes","2"
"240","GO:0045947","negative regulation of translational initiation",14,4,0.43,0.02266,"Biological Processes","2"
"241","GO:0051457","maintenance of protein location in nucleus",12,3,0.36,0.02274,"Biological Processes","2"
"242","GO:0085020","protein K6-linked ubiquitination",8,2,0.24,0.02281,"Biological Processes","2"
"243","GO:0045176","apical protein localization",8,2,0.24,0.02281,"Biological Processes","2"
"244","GO:0035279","miRNA-mediated gene silencing by mRNA destabilizati...",8,2,0.24,0.02281,"Biological Processes","2"
"245","GO:0035562","negative regulation of chromatin binding",8,2,0.24,0.02281,"Biological Processes","2"
"246","GO:0002230","positive regulation of defense response to virus by...",21,3,0.64,0.02464,"Biological Processes","2"
"247","GO:0050891","multicellular organismal-level water homeostasis",18,3,0.55,0.02867,"Biological Processes","2"
"248","GO:0070317","negative regulation of G0 to G1 transition",9,2,0.27,0.02875,"Biological Processes","2"
"249","GO:0071360","cellular response to exogenous dsRNA",9,2,0.27,0.02875,"Biological Processes","2"
"250","GO:0070268","cornification",9,2,0.27,0.02875,"Biological Processes","2"
"251","GO:0072708","response to sorbitol",4,2,0.12,0.0303,"Biological Processes","2"
"252","GO:1903429","regulation of cell maturation",48,3,1.46,0.03032,"Biological Processes","2"
